{"checked_at":"2026-10-07T05:43:26.091Z","declared_implementation_validation_status":"indeterminate","effective_cleanup_status":"succeeded","effective_implementation_validation_status":"indeterminate","effective_leak_audit_status":"clean","effective_lease_status":"released","effective_status_reasons":[{"code":"TRIAL_NOT_VALID","detail":"trial_validity is indeterminate; expected valid","subject":"trial 1 (CONTROL)"},{"code":"CONTROL_VERDICT_INDETERMINATE","detail":"preservation_verdict is indeterminate; expected a conclusive pass or fail","subject":"trial 1 (CONTROL)"},{"code":"TRIAL_NOT_VALID","detail":"trial_validity is indeterminate; expected valid","subject":"trial 2 (COMMIT_THEN_TIMEOUT)"},{"code":"TREATMENT_VERDICT_INDETERMINATE","detail":"preservation_verdict is indeterminate; expected a conclusive pass or fail","subject":"trial 2 (COMMIT_THEN_TIMEOUT)"},{"code":"LATE_EVIDENCE_UNVERIFIED","detail":"late_evidence_status is unverified; expected none or consistent","subject":"late_evidence_status"}],"evidence_refs":[{"artifact_path":"summary/validation-summary.json","artifact_sha256":"2b8b43f9a7f3635d01d35dab03f25bca5cd592781da3e4335a2eee7c8cce7e5d","package_index_sha256":"f8a19a5a2f5394e13db089bd5be56c4d4bb78209aab5077f4df38c8d86f7934c"},{"artifact_path":"trials/1eb6ecba-5dc4-4ae0-8bd5-6fcc9a365572/derived/oracle-result.json","artifact_sha256":"ae5819cd24cec06af758de5a4bed38dcb8d061c54c5721c355690aee7255a1d3","package_index_sha256":"f8a19a5a2f5394e13db089bd5be56c4d4bb78209aab5077f4df38c8d86f7934c"},{"artifact_path":"trials/7aeb0d62-5c7e-4494-9002-0063c4e65f03/derived/oracle-result.json","artifact_sha256":"d3abbad4e00f655b838d44e7a0723f0ff2a857693b1b79a60f3eb111c0d6725a","package_index_sha256":"f8a19a5a2f5394e13db089bd5be56c4d4bb78209aab5077f4df38c8d86f7934c"}],"operational_recovery_applied":false,"original_package_index_sha256":"f8a19a5a2f5394e13db089bd5be56c4d4bb78209aab5077f4df38c8d86f7934c","package_eligibility":"eligible","record_type":"variant_validation_verification","schema_version":1,"selected_amendment_head_sha256":null,"validation_summary_ref":{"artifact_path":"summary/validation-summary.json","artifact_sha256":"2b8b43f9a7f3635d01d35dab03f25bca5cd592781da3e4335a2eee7c8cce7e5d","package_index_sha256":"f8a19a5a2f5394e13db089bd5be56c4d4bb78209aab5077f4df38c8d86f7934c"},"validation_validity":"indeterminate","variant_validation_id":"eda6019a-0f5d-4565-a809-b129ec432036"}
