{"checked_at":"2026-10-07T06:03:17.553Z","declared_implementation_validation_status":"verified","effective_cleanup_status":"succeeded","effective_implementation_validation_status":"verified","effective_leak_audit_status":"clean","effective_lease_status":"released","effective_status_reasons":[],"evidence_refs":[{"artifact_path":"summary/validation-summary.json","artifact_sha256":"49093576104f53f960b6f5ffc29d5d4aa593ccca8ae37368a5e5ca38147bfbec","package_index_sha256":"b7fc14264129736e8e202fdc2c52cd590efa94bd2ab83bc7b8da9b2631e3edb8"},{"artifact_path":"trials/217c7cb6-6d7a-4a75-95e1-c82aeec69761/derived/oracle-result.json","artifact_sha256":"49edc93e03793afc67e276cca877d311bd77dc476feba2038ab535526bde8285","package_index_sha256":"b7fc14264129736e8e202fdc2c52cd590efa94bd2ab83bc7b8da9b2631e3edb8"},{"artifact_path":"trials/abe77042-33ec-4391-8ea3-b655873aff45/derived/oracle-result.json","artifact_sha256":"71426b055931cf4146f65db10d274a55ac91e3670851fa2114833df7dd63891e","package_index_sha256":"b7fc14264129736e8e202fdc2c52cd590efa94bd2ab83bc7b8da9b2631e3edb8"}],"operational_recovery_applied":false,"original_package_index_sha256":"b7fc14264129736e8e202fdc2c52cd590efa94bd2ab83bc7b8da9b2631e3edb8","package_eligibility":"eligible","record_type":"variant_validation_verification","schema_version":1,"selected_amendment_head_sha256":null,"validation_summary_ref":{"artifact_path":"summary/validation-summary.json","artifact_sha256":"49093576104f53f960b6f5ffc29d5d4aa593ccca8ae37368a5e5ca38147bfbec","package_index_sha256":"b7fc14264129736e8e202fdc2c52cd590efa94bd2ab83bc7b8da9b2631e3edb8"},"validation_validity":"valid","variant_validation_id":"60511328-ab4d-4234-81ab-0b042a20e658"}
